<?xml version='1.0' encoding='utf-8'?>
<ns0:SMC_Atc xmlns:ns0="http://ccsap.bit.admin.ch/SWISSMEDIC/LIMS_HMIT_KHZ" xmlns:xsi="http://www.w3.org/2001/XMLSchema-instance" xsi:schemaLocation="http://ccsap.bit.admin.ch/SWISSMEDIC/LIMS_HMIT_KHZ https://ogd.swissmedic.ch/hmd/ZL/172/Beschreibungen/OGD-ATC-Codes.xsd"><ATC><ATC_CODE>C01EX</ATC_CODE><ATC_INDIKATIONS_BESCHREIBUNG>OTHER CARDIAC COMBINATION PRODUCTS</ATC_INDIKATIONS_BESCHREIBUNG></ATC><ATC><ATC_CODE>D11AX</ATC_CODE><ATC_INDIKATIONS_BESCHREIBUNG>OTHER DERMATOLOGICALS</ATC_INDIKATIONS_BESCHREIBUNG></ATC><ATC><ATC_CODE>R02AX</ATC_CODE><ATC_INDIKATIONS_BESCHREIBUNG>OTHER THROAT PREPARATIONS</ATC_INDIKATIONS_BESCHREIBUNG></ATC><ATC><ATC_CODE>S01CA01</ATC_CODE><ATC_INDIKATIONS_BESCHREIBUNG>DEXAMETHASONE AND ANTIINFECTIVES</ATC_INDIKATIONS_BESCHREIBUNG></ATC></ns0:SMC_Atc>